[{"id": "gronsfeld-271", "title": "gronsfeld \u2014 Intermediate", "cipher_family": "polyalphabetic", "cipher_type": "gronsfeld", "plaintext": "WE HOLD THESE TRUTHS TO BE SELF EVIDENT THAT ALL MEN ARE CREATED EQUAL", "ciphertext": "FNQXUMCQNBNCADCQBCXKNBNUONERMNWCCQJCJUUVNWJANLANJCNMNZDJU", "key": {"type": "numeric", "value": "99999"}, "language": "en", "alphabet": "A-Z", "text_length": 57, "normalized_text_length": 57, "spacing": "removed", "punctuation": "removed", "casing": "uppercase", "difficulty": "intermediate", "source_type": "synthetic", "source": "Generated by Cipher Museum", "license": "CC0", "notes": "", "expected_attacks": ["Kasiski examination", "frequency analysis", "numeric key recovery"], "tags": ["classical", "polyalphabetic", "numeric-key", "gronsfeld"], "created_by": "Cipher Museum", "verified": true, "dataset_version": "0.2", "split": "blind", "transcription_quality": "clean", "source_provenance": {"url": "https://ciphermuseum.com/cipher-corpus.html", "archive": "Cipher Museum Synthetic Corpus", "publication_date": "2026-04-27", "license": "CC0"}}, {"id": "bazeries-313", "title": "bazeries \u2014 Advanced", "cipher_family": "transposition", "cipher_type": "bazeries", "plaintext": "ENEMY FORCES NEAR", "ciphertext": "JSHSXWNKSTJOFSN", "key": {"type": "integer", "value": 56}, "language": "en", "alphabet": "A-Z", "text_length": 15, "normalized_text_length": 15, "spacing": "removed", "punctuation": "removed", "casing": "uppercase", "difficulty": "advanced", "source_type": "synthetic", "source": "Generated by Cipher Museum", "license": "CC0", "notes": "", "expected_attacks": ["transposition recovery", "frequency analysis", "Bazeries method"], "tags": ["historical", "french", "transposition", "substitution", "combined"], "created_by": "Cipher Museum", "verified": true, "dataset_version": "0.2", "split": "blind", "transcription_quality": "clean", "source_provenance": {"url": "https://ciphermuseum.com/cipher-corpus.html", "archive": "Cipher Museum Synthetic Corpus", "publication_date": "2026-04-27", "license": "CC0"}}, {"id": "vigenere-344", "title": "vigenere \u2014 Intermediate", "cipher_family": "polyalphabetic", "cipher_type": "vigenere", "plaintext": "ELEMENTARY MY DEAR WATSON THE GAME IS AFOOT AND THE CRIMINAL IS CLOSE", "ciphertext": "OPCISEWKVWIMUHKVUWHJRXXFAURPOMQWTFRDELZHYHMVGIWEDVMQYZFVO", "key": {"type": "keyword", "value": "KEYWORD"}, "language": "en", "alphabet": "A-Z", "text_length": 57, "normalized_text_length": 57, "spacing": "removed", "punctuation": "removed", "casing": "uppercase", "difficulty": "intermediate", "source_type": "synthetic", "source": "Generated by Cipher Museum", "license": "CC0", "notes": "", "expected_attacks": ["Kasiski examination", "index of coincidence", "frequency analysis"], "tags": ["classical", "polyalphabetic", "keyword", "intermediate"], "created_by": "Cipher Museum", "verified": true, "dataset_version": "0.2", "split": "public", "transcription_quality": "clean", "source_provenance": {"url": "https://ciphermuseum.com/cipher-corpus.html", "archive": "Cipher Museum Synthetic Corpus", "publication_date": "2026-04-27", "license": "CC0"}}, {"id": "hist-chaocipher-byrne-001", "title": "Chaocipher \u2014 J.F. Byrne Original Example, 1918", "cipher_family": "substitution", "cipher_type": "chaocipher", "plaintext": "THIS CIPHER IS SOLVED", "ciphertext": "OAHQHCNYNXTSZJRRHJBYHQKSOUJY", "key": {"initial_left": "HXUCZVAMDSLKPEFJRIGTWOBNYQ", "initial_right": "PTLNBQDEOYSFAVZKGJRIHWXUMC"}, "language": "en", "alphabet": "A-Z", "text_length": 28, "normalized_text_length": 28, "spacing": "preserved", "punctuation": "removed", "casing": "uppercase", "difficulty": "advanced", "source_type": "historical", "source": "J.F. Byrne, 'Silent Years' \u2014 Chapter on Chaocipher, 1953", "license": "public domain", "notes": "J.F. Byrne invented the Chaocipher in 1918 and tried for decades to interest the US Government in it. The algorithm was finally revealed posthumously in 2010 by his family.", "expected_attacks": ["algorithmic reconstruction", "statistical attack", "known plaintext"], "tags": ["chaocipher", "byrne", "historical", "1918", "advanced"], "created_by": "Cipher Museum", "verified": true, "dataset_version": "0.2", "split": "public", "transcription_quality": "clean", "historical_context": "John Francis Byrne invented the Chaocipher in 1918 and claimed it was unbreakable. He described it in his 1953 autobiography 'Silent Years' but refused to reveal the algorithm. Byrne challenged the US Government to break it without success. His family donated the machine and papers to the National Cryptologic Museum in 2010, finally revealing the algorithm.", "year": "1918", "source_provenance": {"url": "https://www.cryptomuseum.com/crypto/chaocipher/", "archive": "CryptoMuseum \u2014 Chaocipher", "publication_date": "2010", "license": "public domain"}}, {"id": "hist-beale-001", "title": "Beale Cipher \u2014 Paper No. 2 (Treasure Location) \u2014 Excerpt", "cipher_family": "codebook", "cipher_type": "book_cipher", "plaintext": "ICOMMENCEATTHEPOINTMARKEDWITHANXINTHEGROUNDANDSHALLFINDACONCEALEDENTRANCETOANUNDERGROUNDCHAMBER", "ciphertext": "115 73 24 807 37 52 49 17 31 62 647 22 7 15 140 47 29 107 79 84 56 239 10 26 811 5 196 308 85 52 160 136 59 211 36 9 46 316 554 122 106 95 53 58 2 42 7 35 122 53 31 82 77 250 196 56 96 118 71 140 287 28 353 37 1005 65 147 807 24 3 8 12 47 43 59 807 45 316 101 41 78 154 1005 122 138 191 16 77 49 102 57 72 34 73 85 35 371", "key": {"type": "none", "value": null, "label": "Declaration of Independence (word position \u2192 first letter)"}, "language": "en", "alphabet": "A-Z", "text_length": 97, "normalized_text_length": 97, "spacing": "removed", "punctuation": "removed", "casing": "uppercase", "difficulty": "expert", "source_type": "historical", "source": "Beale Papers, published by J.B. Ward (1885). Paper No. 2 decoded using Declaration of Independence as key. Papers 1 and 3 remain unsolved.", "license": "public domain", "notes": "The Beale Ciphers are three encoded texts allegedly describing the location of a buried treasure in Bedford County, Virginia. Only Paper No. 2 has been decoded, using the Declaration of Independence as a book cipher key (number = Nth word, first letter).", "expected_attacks": ["book identification", "word frequency analysis", "Declaration of Independence mapping"], "tags": ["historical", "beale", "book-cipher", "treasure", "unsolved-1-and-3", "american"], "created_by": "Cipher Museum", "verified": true, "dataset_version": "0.2", "split": "public", "transcription_quality": "noisy", "source_provenance": {"url": "https://ciphermuseum.com/cipher-corpus.html", "archive": "Ward, J.B. 'The Beale Papers' (1885), Lynchburg, Virginia", "publication_date": "1885", "license": "public domain"}, "year": "1820", "historical_context": "The Beale Papers were published in 1885 by J.B. Ward. Paper No. 2 was decoded in 1885 using the Declaration of Independence as a keyword: each number maps to the Nth word, and the first letter of that word gives the plaintext letter. Papers 1 and 3 remain unsolved.", "known_solution_method": "Declaration of Independence book cipher mapping (1=W, 2=h, etc.)"}, {"id": "morse-code-049", "title": "morse code \u2014 Beginner", "cipher_family": "encoding", "cipher_type": "morse_code", "plaintext": "TO BE OR NOT TO BE THAT IS THE QUESTION WHETHER TIS NOBLER IN THE MIND", "ciphertext": "- --- / -... . / --- .-. / -. --- - / - --- / -... . / - .... .- - / .. ... / - .... . / --.- ..- . ... - .. --- -. / .-- .... . - .... . .-. / - .. ... / -. --- -... .-.. . .-. / .. -. / - .... . / -- .. -. -..", "key": {"type": "none", "value": null}, "language": "en", "alphabet": "A-Z", "text_length": 211, "normalized_text_length": 0, "spacing": "preserved", "punctuation": "mixed", "casing": "uppercase", "difficulty": "beginner", "source_type": "synthetic", "source": "Generated by Cipher Museum", "license": "CC0", "notes": "", "expected_attacks": ["known encoding scheme", "symbol frequency"], "tags": ["encoding", "telegraph", "morse", "international"], "created_by": "Cipher Museum", "verified": true, "dataset_version": "0.2", "split": "public", "transcription_quality": "clean", "source_provenance": {"url": "https://ciphermuseum.com/cipher-corpus.html", "archive": "Cipher Museum Synthetic Corpus", "publication_date": "2026-04-27", "license": "CC0"}}, {"id": "voynich-render-028", "title": "voynich render \u2014 Expert", "cipher_family": "substitution", "cipher_type": "voynich_render", "plaintext": "EVACUATE THE BASE", "ciphertext": "dvoyzogd gcd aoxd", "key": {"type": "none", "value": null}, "language": "en", "alphabet": "A-Z", "text_length": 17, "normalized_text_length": 15, "spacing": "preserved", "punctuation": "mixed", "casing": "mixed", "difficulty": "expert", "source_type": "synthetic", "source": "Generated by Cipher Museum", "license": "CC0", "notes": "", "expected_attacks": ["symbol frequency analysis", "glyph substitution", "linguistic analysis"], "tags": ["historical", "unsolved", "voynich", "visualization", "enigmatic"], "created_by": "Cipher Museum", "verified": true, "dataset_version": "0.2", "split": "public", "transcription_quality": "clean", "source_provenance": {"url": "https://ciphermuseum.com/cipher-corpus.html", "archive": "Cipher Museum Synthetic Corpus", "publication_date": "2026-04-27", "license": "CC0"}}, {"id": "cardano-autokey-051", "title": "cardano autokey \u2014 Advanced", "cipher_family": "polyalphabetic", "cipher_type": "cardano_autokey", "plaintext": "KNOWLEDGE IS POWER AND INFORMATION IS THE KEY TO VICTORY IN ANY CONFLICT", "ciphertext": "MXBKHPHJKMAHDKAVRNQLVSTFDMTBWBVALALOOCRHJDKVHFPGVNNLAQBSQTKV", "key": {"type": "keyword", "value": "CARDANO"}, "language": "en", "alphabet": "A-Z", "text_length": 60, "normalized_text_length": 60, "spacing": "removed", "punctuation": "removed", "casing": "uppercase", "difficulty": "advanced", "source_type": "synthetic", "source": "Generated by Cipher Museum", "licens